[
  {
    "schema_version": "1.0.0",
    "query_id": "q:main:001",
    "raw_text": "What's the difference between epipremnum and pothos?",
    "platform": "reddit",
    "url": "https://www.reddit.com/r/plants/comments/henlvp/",
    "source_location": "post_title",
    "language": "en",
    "plant_id": "plant:epipremnum_aureum",
    "alias_used": "epipremnum / pothos",
    "expected_dimensions": ["taxonomy"],
    "gold_entry_ids": ["kb:pothos_taxonomy_001"],
    "status": "covered",
    "answer_shape": "identity",
    "question_type": "alias_or_coreference",
    "context_requirement": "none"
  },
  {
    "schema_version": "1.0.0",
    "query_id": "q:main:002",
    "raw_text": "I've always known them as snake plants, or sansevieria. Anyone else hear of that nickname?",
    "platform": "reddit",
    "url": "https://www.reddit.com/r/houseplants/comments/ur1zta/",
    "source_location": "post_body",
    "language": "en",
    "plant_id": "plant:dracaena_trifasciata",
    "alias_used": "snake plants / sansevieria",
    "expected_dimensions": ["taxonomy"],
    "gold_entry_ids": ["kb:snake_plant_taxonomy_001"],
    "status": "covered",
    "answer_shape": "identity",
    "question_type": "alias_or_coreference",
    "context_requirement": "none"
  },
  {
    "schema_version": "1.0.0",
    "query_id": "q:main:003",
    "raw_text": "Sansevieria reclassified as Dracaena??",
    "platform": "reddit",
    "url": "https://www.reddit.com/r/houseplants/comments/fai09b/",
    "source_location": "post_title",
    "language": "en",
    "plant_id": "plant:dracaena_trifasciata",
    "alias_used": "Sansevieria / Dracaena",
    "expected_dimensions": ["taxonomy"],
    "gold_entry_ids": ["kb:snake_plant_taxonomy_001"],
    "status": "covered",
    "answer_shape": "identity",
    "question_type": "alias_or_coreference",
    "context_requirement": "none"
  },
  {
    "schema_version": "1.0.0",
    "query_id": "q:main:004",
    "raw_text": "Silly question 🌿🪴what on earth is the difference between a monstera and a split leaf philodendron?",
    "platform": "reddit",
    "url": "https://www.reddit.com/r/houseplants/comments/oubvhk/",
    "source_location": "post_title",
    "language": "en",
    "plant_id": "plant:monstera_deliciosa",
    "alias_used": "monstera / split leaf philodendron",
    "expected_dimensions": ["taxonomy"],
    "gold_entry_ids": ["kb:monstera_taxonomy_001"],
    "status": "partial",
    "answer_shape": "identity",
    "question_type": "alias_or_coreference",
    "context_requirement": "none",
    "notes": "现有条目可说明属级归属，但没有专门解释该历史俗名的歧义。"
  },
  {
    "schema_version": "1.0.0",
    "query_id": "q:main:005",
    "raw_text": "I have a low light shelf that gets artificial light, and I'm looking to try a Pothos because everyone on this reddit keeps telling me to!",
    "platform": "reddit",
    "url": "https://www.reddit.com/r/houseplants/comments/nhwh8z/",
    "source_location": "post_title",
    "language": "en",
    "plant_id": "plant:epipremnum_aureum",
    "alias_used": "Pothos",
    "expected_dimensions": ["lighting"],
    "gold_entry_ids": ["kb:pothos_lighting_001"],
    "status": "covered",
    "answer_shape": "recommendation",
    "question_type": "direct",
    "context_requirement": "none"
  },
  {
    "schema_version": "1.0.0",
    "query_id": "q:main:006",
    "raw_text": "I‘ve never had a pothos look so bad - could it be because of low light? Its in a north facing room with a relatively small window",
    "platform": "reddit",
    "url": "https://www.reddit.com/r/plantclinic/comments/11q7f5c/",
    "source_location": "post_title",
    "language": "en",
    "plant_id": "plant:epipremnum_aureum",
    "alias_used": "pothos",
    "expected_dimensions": ["lighting", "symptom"],
    "gold_entry_ids": ["kb:pothos_lighting_001", "kb:pothos_symptom_low_light_001"],
    "status": "covered",
    "answer_shape": "diagnosis_list",
    "question_type": "compound",
    "context_requirement": "image"
  },
  {
    "schema_version": "1.0.0",
    "query_id": "q:main:007",
    "raw_text": "How much light do snake plant need?",
    "platform": "reddit",
    "url": "https://www.reddit.com/r/houseplants/comments/1c3phfz/",
    "source_location": "post_title",
    "language": "en",
    "plant_id": "plant:dracaena_trifasciata",
    "alias_used": "snake plant",
    "expected_dimensions": ["lighting"],
    "gold_entry_ids": ["kb:snake_plant_lighting_001"],
    "status": "covered",
    "answer_shape": "conditional",
    "question_type": "direct",
    "context_requirement": "none"
  },
  {
    "schema_version": "1.0.0",
    "query_id": "q:main:008",
    "raw_text": "I placed it about 5–6m from a west-facing window where it gets some afternoon sun—does that sound like a good spot?",
    "platform": "reddit",
    "url": "https://www.reddit.com/r/houseplants/comments/1rwhais/",
    "source_location": "post_body",
    "language": "en",
    "plant_id": "plant:monstera_deliciosa",
    "alias_used": null,
    "expected_dimensions": ["lighting"],
    "gold_entry_ids": ["kb:monstera_lighting_001"],
    "status": "covered",
    "answer_shape": "yes_no",
    "question_type": "alias_or_coreference",
    "context_requirement": "thread_context",
    "excluded_from_single_turn": true
  },
  {
    "schema_version": "1.0.0",
    "query_id": "q:main:009",
    "raw_text": "Is this too much/enough light for my monstera?",
    "platform": "reddit",
    "url": "https://www.reddit.com/r/houseplants/comments/18bgy3i/",
    "source_location": "post_title",
    "language": "en",
    "plant_id": "plant:monstera_deliciosa",
    "alias_used": "monstera",
    "expected_dimensions": ["lighting"],
    "gold_entry_ids": ["kb:monstera_lighting_001"],
    "status": "covered",
    "answer_shape": "yes_no",
    "question_type": "judgment_or_premise",
    "context_requirement": "image"
  },
  {
    "schema_version": "1.0.0",
    "query_id": "q:main:010",
    "raw_text": "Plants that do well with little to no light?",
    "platform": "reddit",
    "url": "https://www.reddit.com/r/houseplants/comments/sxjqsb/",
    "source_location": "post_title",
    "language": "en",
    "plant_id": null,
    "alias_used": null,
    "expected_dimensions": ["lighting"],
    "gold_entry_ids": ["kb:pothos_lighting_001", "kb:snake_plant_lighting_001"],
    "status": "partial",
    "answer_shape": "recommendation",
    "question_type": "direct",
    "context_requirement": "none",
    "notes": "推荐范围理论上超过现有 3 种植物，gold 只标当前 KB 中可支持的候选。"
  },
  {
    "schema_version": "1.0.0",
    "query_id": "q:main:011",
    "raw_text": "So I got this snake plant/mother-in-law's tongue from some family. Has a big north-facing window so not a ton of light, is that okay?",
    "platform": "reddit",
    "url": "https://www.reddit.com/r/houseplants/comments/12i1eyh/",
    "source_location": "post_body",
    "language": "en",
    "plant_id": "plant:dracaena_trifasciata",
    "alias_used": "snake plant / mother-in-law's tongue",
    "expected_dimensions": ["lighting"],
    "gold_entry_ids": ["kb:snake_plant_lighting_001"],
    "status": "covered",
    "answer_shape": "yes_no",
    "question_type": "judgment_or_premise",
    "context_requirement": "none"
  },
  {
    "schema_version": "1.0.0",
    "query_id": "q:main:012",
    "raw_text": "How often do you water your pothos?",
    "platform": "reddit",
    "url": "https://www.reddit.com/r/houseplants/comments/ez2r73/",
    "source_location": "post_title",
    "language": "en",
    "plant_id": "plant:epipremnum_aureum",
    "alias_used": "pothos",
    "expected_dimensions": ["watering"],
    "gold_entry_ids": ["kb:pothos_watering_001", "kb:pothos_watering_frequency_001"],
    "status": "covered",
    "answer_shape": "numeric_request",
    "answer_shape_support": "supported",
    "question_type": "direct",
    "context_requirement": "none",
    "notes": "召回可正确，但答案必须解释为什么不能只给固定天数。"
  },
  {
    "schema_version": "1.0.0",
    "query_id": "q:main:013",
    "raw_text": "How often do you water?",
    "platform": "reddit",
    "url": "https://www.reddit.com/r/pothos/comments/1th5f2x/",
    "source_location": "post_title",
    "language": "en",
    "plant_id": "plant:epipremnum_aureum",
    "alias_used": null,
    "expected_dimensions": ["watering"],
    "gold_entry_ids": ["kb:pothos_watering_001", "kb:pothos_watering_frequency_001"],
    "status": "covered",
    "answer_shape": "numeric_request",
    "answer_shape_support": "supported",
    "question_type": "alias_or_coreference",
    "context_requirement": "thread_context",
    "excluded_from_single_turn": true,
    "notes": "用户要求固定周期；当前 KB 只能给出按土壤干燥程度判断的条件性答案。"
  },
  {
    "schema_version": "1.0.0",
    "query_id": "q:main:014",
    "raw_text": "How often do you water your Monstera?",
    "platform": "reddit",
    "url": "https://www.reddit.com/r/houseplants/comments/px9y65/",
    "source_location": "post_title",
    "language": "en",
    "plant_id": "plant:monstera_deliciosa",
    "alias_used": "Monstera",
    "expected_dimensions": ["watering"],
    "gold_entry_ids": ["kb:monstera_watering_001", "kb:monstera_watering_frequency_001"],
    "status": "covered",
    "answer_shape": "numeric_request",
    "answer_shape_support": "supported",
    "question_type": "direct",
    "context_requirement": "none",
    "notes": "用户要求固定周期；当前 KB 只能给出按土壤干燥程度判断的条件性答案。"
  },
  {
    "schema_version": "1.0.0",
    "query_id": "q:main:015",
    "raw_text": "How do you tell when it's time to water a monstera?",
    "platform": "reddit",
    "url": "https://www.reddit.com/r/Monstera/comments/14zc1wt/",
    "source_location": "post_title",
    "language": "en",
    "plant_id": "plant:monstera_deliciosa",
    "alias_used": "monstera",
    "expected_dimensions": ["watering"],
    "gold_entry_ids": ["kb:monstera_watering_001"],
    "status": "covered",
    "answer_shape": "conditional",
    "question_type": "direct",
    "context_requirement": "none"
  },
  {
    "schema_version": "1.0.0",
    "query_id": "q:main:016",